{
  "governanceContexts": [
    {
      "id": "context.marketplace-ops",
      "name": "Marketplace trust-signal operating context",
      "description": "Local governance context for interpreting ERC-8004 trust signals."
    }
  ],
  "profiles": [
    {
      "id": "profile.consumer-signal",
      "name": "Consumer trust-signal profile",
      "contextRef": "context.marketplace-ops",
      "requirementRefs": [
        "req.safe-fetch",
        "req.integrity-check"
      ]
    }
  ],
  "requirements": [
    {
      "id": "req.safe-fetch",
      "statement": "metadata retrieval must be bounded and sandboxed",
      "level": "L1"
    },
    {
      "id": "req.integrity-check",
      "statement": "trust signals must pass integrity verification before strong presentation",
      "level": "L1"
    }
  ],
  "entities": [
    {
      "id": "entity.marketplace",
      "type": "application",
      "name": "Example Marketplace",
      "roles": [
        {
          "id": "role.consumer",
          "type": "consumer",
          "authorities": [
            {
              "id": "auth.interpret-signals",
              "scope": "interpret and present trust signals under local policy",
              "source": "local operator policy",
              "conditions": [
                "signals must pass integrity verification",
                "high-risk actions require stronger finality evidence"
              ],
              "revocationStatus": "active",
              "timeBounds": "bounded-by-policy",
              "obligations": [
                "signals must pass integrity verification",
                "high-risk actions require stronger finality evidence"
              ]
            }
          ]
        }
      ]
    }
  ],
  "artifacts": [
    {
      "id": "artifact.erc8004-metadata",
      "type": "fetched-metadata",
      "claims": [
        {
          "id": "claim.reputation-signal",
          "statement": "token carries a high reputation score",
          "subjectRef": "entity.marketplace"
        },
        {
          "id": "claim.finality-status",
          "statement": "transfer is final",
          "subjectRef": "entity.marketplace"
        }
      ]
    }
  ],
  "policies": [
    {
      "id": "policy.signal-handling",
      "name": "Consumer signal handling policy",
      "decisionMode": "mixed",
      "profileRef": "profile.consumer-signal",
      "rules": [
        "downgrade trust cues when finality evidence is weak",
        "show warnings instead of strong badges when risk is unresolved"
      ],
      "contextRef": "context.marketplace-ops"
    }
  ],
  "controls": [
    {
      "id": "control.safe-fetch",
      "type": "sandboxed-fetch",
      "mitigatesThreatRefs": [
        "threat.unsafe-fetch"
      ]
    },
    {
      "id": "control.integrity-check",
      "type": "hash-verification",
      "mitigatesThreatRefs": [
        "threat.badge-theater"
      ]
    }
  ],
  "threats": [
    {
      "id": "threat.unsafe-fetch",
      "type": "unsafe-fetch",
      "description": "Malicious or unbounded metadata retrieval causes unsafe behavior."
    },
    {
      "id": "threat.badge-theater",
      "type": "misleading-signal-presentation",
      "description": "A weakly validated signal is shown as though it were strongly trustworthy."
    }
  ],
  "evidence": [
    {
      "id": "evidence.validation-log",
      "type": "validation-log",
      "supportsRefs": [
        "control.safe-fetch",
        "control.integrity-check",
        "req.safe-fetch",
        "req.integrity-check"
      ]
    }
  ],
  "assessments": [
    {
      "id": "assessment.consumer-profile",
      "method": "consumer conformance review",
      "result": "warn",
      "requirementRefs": [
        "req.safe-fetch",
        "req.integrity-check"
      ],
      "evidenceRefs": [
        "evidence.validation-log"
      ]
    }
  ],
  "verifications": [
    {
      "id": "verification.consumer-check",
      "method": "integrity-and-policy-evaluation",
      "result": "warn",
      "inputRefs": [
        "artifact.erc8004-metadata",
        "evidence.validation-log"
      ]
    }
  ],
  "trustDecisions": [
    {
      "id": "decision.downgrade-signal",
      "outcome": "downgrade",
      "policyRef": "policy.signal-handling",
      "assessmentRefs": [
        "assessment.consumer-profile"
      ],
      "verificationRefs": [
        "verification.consumer-check"
      ],
      "effectRefs": [
        "effect.show-warning"
      ],
      "contextRef": "context.marketplace-ops",
      "authorityRefs": [
        "auth.interpret-signals"
      ]
    }
  ],
  "effects": [
    {
      "id": "effect.show-warning",
      "class": "interaction",
      "action": "show contextual warning and suppress strong trust badge",
      "status": "degraded"
    }
  ],
  "levelFrameworks": [
    {
      "id": "levels.consumer-rigor",
      "name": "Consumer decision rigor levels",
      "levels": [
        "L1",
        "L2"
      ]
    }
  ],
  "lifecycleEvents": [
    {
      "id": "event.metadata-refresh",
      "type": "refresh",
      "targetRef": "artifact.erc8004-metadata"
    }
  ]
}
