{
  "governanceContexts": [
    {
      "id": "context.trust-registry-program",
      "name": "Trust Registry Governance Program",
      "description": "Institutional governance context for registry publishing and reliance."
    }
  ],
  "profiles": [
    {
      "id": "profile.tspp-like",
      "name": "Registry Security and Privacy Baseline",
      "contextRef": "context.trust-registry-program",
      "requirementRefs": [
        "req.freshness",
        "req.signed-response"
      ]
    }
  ],
  "requirements": [
    {
      "id": "req.freshness",
      "statement": "registry metadata must satisfy the defined freshness window",
      "level": "AL1"
    },
    {
      "id": "req.signed-response",
      "statement": "signed response envelope required for higher-assurance use",
      "level": "AL2"
    }
  ],
  "entities": [
    {
      "id": "entity.registry-operator",
      "type": "organization",
      "name": "Example Trust Registry Operator",
      "roles": [
        {
          "id": "role.operator",
          "type": "operator",
          "authorities": [
            {
              "id": "auth.publish-registry-metadata",
              "scope": "publish trust registry metadata and query responses",
              "source": "governance framework",
              "conditions": [
                "responses must satisfy freshness policy",
                "signed response required for higher-assurance use"
              ],
              "revocationStatus": "active",
              "timeBounds": "bounded-by-policy",
              "obligations": [
                "responses must satisfy freshness policy",
                "signed response required for higher-assurance use"
              ]
            }
          ]
        }
      ]
    }
  ],
  "artifacts": [
    {
      "id": "artifact.registry-metadata",
      "type": "metadata-document",
      "claims": [
        {
          "id": "claim.signed-response-supported",
          "statement": "registry supports signed response envelopes",
          "subjectRef": "entity.registry-operator"
        },
        {
          "id": "claim.freshness-window",
          "statement": "metadata freshness window is 24 hours",
          "subjectRef": "entity.registry-operator"
        }
      ]
    }
  ],
  "policies": [
    {
      "id": "policy.registry-reliance",
      "name": "Registry reliance policy",
      "decisionMode": "mixed",
      "profileRef": "profile.tspp-like",
      "rules": [
        "accept informational use when metadata freshness verification passes",
        "require signed response for high-assurance automated gating"
      ],
      "contextRef": "context.trust-registry-program"
    }
  ],
  "controls": [
    {
      "id": "control.response-signing",
      "type": "signed-response-envelope",
      "mitigatesThreatRefs": [
        "threat.spoofed-response"
      ]
    }
  ],
  "threats": [
    {
      "id": "threat.spoofed-response",
      "type": "spoofed-metadata",
      "description": "An attacker serves altered registry metadata or a fake response."
    }
  ],
  "evidence": [
    {
      "id": "evidence.conformance-report",
      "type": "test-output",
      "supportsRefs": [
        "claim.signed-response-supported",
        "control.response-signing",
        "req.signed-response"
      ]
    }
  ],
  "assessments": [
    {
      "id": "assessment.profile-evaluation",
      "method": "profile-based conformance review",
      "result": "pass-with-warning",
      "requirementRefs": [
        "req.freshness",
        "req.signed-response"
      ],
      "evidenceRefs": [
        "evidence.conformance-report"
      ]
    }
  ],
  "verifications": [
    {
      "id": "verification.metadata-check",
      "method": "schema-plus-signature-validation",
      "result": "pass",
      "inputRefs": [
        "artifact.registry-metadata",
        "evidence.conformance-report"
      ]
    }
  ],
  "levelFrameworks": [
    {
      "id": "levels.assurance",
      "name": "Assurance levels",
      "levels": [
        "AL1",
        "AL2",
        "AL3",
        "AL4"
      ]
    }
  ],
  "trustDecisions": [
    {
      "id": "decision.accept-bounded",
      "outcome": "accept-with-warning",
      "policyRef": "policy.registry-reliance",
      "assessmentRefs": [
        "assessment.profile-evaluation"
      ],
      "verificationRefs": [
        "verification.metadata-check"
      ],
      "effectRefs": [
        "effect.show-result"
      ],
      "contextRef": "context.trust-registry-program",
      "authorityRefs": [
        "auth.publish-registry-metadata"
      ]
    }
  ],
  "effects": [
    {
      "id": "effect.show-result",
      "class": "informational",
      "action": "display registry result but do not auto-approve onboarding",
      "status": "degraded"
    }
  ],
  "lifecycleEvents": [
    {
      "id": "event.metadata-update",
      "type": "metadata-update",
      "targetRef": "artifact.registry-metadata"
    }
  ]
}
